reports/hw03/raw/per_query_results.json

{"technique": "token", "query": "What PyYAML method could allow arbitrary code execution and when was it fixed?", "rank": 1, "store_score": 0.7376856034206685, "cosine_sim": 0.7237804265392968, "chunk_len": 804, "preview": "could use this flaw to execute arbitrary code on the system by abusing the python/object/new constructor. vulnerability fixed in versions: 5.3.1 links:  -------", "source_file": "PyYAML.txt", "latency": 10.583900002529845}
{"technique": "token", "query": "What PyYAML method could allow arbitrary code execution and when was it fixed?", "rank": 2, "store_score": 0.7269823147773711, "cosine_sim": 0.7264973669635378, "chunk_len": 702, "preview": "package: PyYAML (version:pyyaml/5.3) vulnerability count: 4  id: PYSEC-2020-96 aliases: CVE-2020-1747, CVE-2025-50460, GHSA-6757-jp84-gxfx, GHSA-fm6c-f59h-7mmg ", "source_file": "PyYAML.txt", "latency": 10.583900002529845}
{"technique": "token", "query": "What PyYAML method could allow arbitrary code execution and when was it fixed?", "rank": 3, "store_score": 0.723178376665112, "cosine_sim": 0.6947960142607781, "chunk_len": 796, "preview": "attacker to execute arbitrary code on the system by abusing the python/object/new constructor. This flaw is due to an incomplete fix for CVE-2020-1747. vulnerab", "source_file": "PyYAML.txt", "latency": 10.583900002529845}
{"technique": "token", "query": "What bug affected Paramiko's write_private_key_file?", "rank": 1, "store_score": 0.7504473933474267, "cosine_sim": 0.7290187621460011, "chunk_len": 530, "preview": "package: paramiko (version:paramiko/2.4.1) vulnerability count: 4  id: PYSEC-2022-166 aliases: CVE-2022-24302, GHSA-f8q4-jwww-x3wv summary: None details: In Par", "source_file": "paramiko.txt", "latency": 13.104000001476379}
{"technique": "token", "query": "What bug affected Paramiko's write_private_key_file?", "rank": 2, "store_score": 0.5666308442881579, "cosine_sim": 0.5682809410690168, "chunk_len": 491, "preview": "None details: Paramiko version 2.4.1, 2.3.2, 2.2.3, 2.1.5, 2.0.8, 1.18.5, 1.17.6 contains a Incorrect Access Control vulnerability in SSH server that can result", "source_file": "paramiko.txt", "latency": 13.104000001476379}
{"technique": "token", "query": "What bug affected Paramiko's write_private_key_file?", "rank": 3, "store_score": 0.5454592137383141, "cosine_sim": 0.4699150282476977, "chunk_len": 426, "preview": "PYSEC-2026-2858 summary: None details: In Paramiko through 4.0.0 before a448945, rsakey.py allows the SHA-1 algorithm. vulnerability fixed in versions:  links: ", "source_file": "paramiko.txt", "latency": 13.104000001476379}
{"technique": "token", "query": "What NumPy component had a string comparision bug and when was it fixed?", "rank": 1, "store_score": 0.6438786751020473, "cosine_sim": 0.6877965828168188, "chunk_len": 376, "preview": "package: numpy (version:numpy/1.21.0) vulnerability count: 1  id: GHSA-fpfv-jqm9-f5jm aliases: CVE-2021-34141, PYSEC-2021-855 summary: None details: Incomplete ", "source_file": "numpy.txt", "latency": 11.939399999391753}
{"technique": "token", "query": "What NumPy component had a string comparision bug and when was it fixed?", "rank": 2, "store_score": 0.3835672484698441, "cosine_sim": 0.4082623583283577, "chunk_len": 607, "preview": "fixed in versions: 12.2.0 links:  --------------------------- id: PYSEC-2026-165 aliases: CVE-2026-42308, GHSA-wjx4-4jcj-g98j summary: None details: Pillow is a", "source_file": "pillow.txt", "latency": 11.939399999391753}
{"technique": "token", "query": "What NumPy component had a string comparision bug and when was it fixed?", "rank": 3, "store_score": 0.37373443152450353, "cosine_sim": 0.3880033653290349, "chunk_len": 875, "preview": "small subgroup.  Only SECT curves are impacted by this.  ## Credit  This vulnerability was discovered by: - XlabAI Team of Tencent Xuanwu Lab - Atuin Automated ", "source_file": "cryptography.txt", "latency": 11.939399999391753}
{"technique": "token", "query": "Which package has the most vulnerabilites in the datasets?", "rank": 1, "store_score": 0.38582285795735216, "cosine_sim": 0.42865609164071083, "chunk_len": 376, "preview": "package: numpy (version:numpy/1.21.0) vulnerability count: 1  id: GHSA-fpfv-jqm9-f5jm aliases: CVE-2021-34141, PYSEC-2021-855 summary: None details: Incomplete ", "source_file": "numpy.txt", "latency": 12.402899999869987}
{"technique": "token", "query": "Which package has the most vulnerabilites in the datasets?", "rank": 2, "store_score": 0.3659654600977958, "cosine_sim": 0.3765998807712292, "chunk_len": 597, "preview": "package: pillow (version:pillow/8.2.0) vulnerability count: 52  id: PYSEC-2021-331 aliases: CVE-2021-34552, GHSA-7534-mm45-c74v summary: None details: Pillow th", "source_file": "pillow.txt", "latency": 12.402899999869987}
{"technique": "token", "query": "Which package has the most vulnerabilites in the datasets?", "rank": 3, "store_score": 0.3561612971373889, "cosine_sim": 0.39722910619797513, "chunk_len": 574, "preview": "BIT-pillow-2022-45198, CVE-2022-45198, GHSA-m2vv-5vj5-2hm7 summary: None details: Pillow before 9.2.0 performs Improper Handling of Highly Compressed GIF Data (", "source_file": "pillow.txt", "latency": 12.402899999869987}
{"technique": "token", "query": "Name two packages with RCE related vulnerabilites in SSH or networking code.", "rank": 1, "store_score": 0.5314376664899716, "cosine_sim": 0.5330640997602768, "chunk_len": 491, "preview": "None details: Paramiko version 2.4.1, 2.3.2, 2.2.3, 2.1.5, 2.0.8, 1.18.5, 1.17.6 contains a Incorrect Access Control vulnerability in SSH server that can result", "source_file": "paramiko.txt", "latency": 11.166299998876639}
{"technique": "token", "query": "Name two packages with RCE related vulnerabilites in SSH or networking code.", "rank": 2, "store_score": 0.38387895453664295, "cosine_sim": 0.40500948641356066, "chunk_len": 519, "preview": "site) reactor.run() ``` Output: ``` \u276f curl -H\"Host:<h1>HELLO THERE</h1>\" http://localhost:8080/  <html>   <head><title>404 - No Such Resource</title></head>   <", "source_file": "Twisted.txt", "latency": 11.166299998876639}
{"technique": "token", "query": "Name two packages with RCE related vulnerabilites in SSH or networking code.", "rank": 3, "store_score": 0.35080859497206895, "cosine_sim": 0.37791884441974266, "chunk_len": 376, "preview": "package: numpy (version:numpy/1.21.0) vulnerability count: 1  id: GHSA-fpfv-jqm9-f5jm aliases: CVE-2021-34141, PYSEC-2021-855 summary: None details: Incomplete ", "source_file": "numpy.txt", "latency": 11.166299998876639}
{"technique": "semantic", "query": "What PyYAML method could allow arbitrary code execution and when was it fixed?", "rank": 1, "store_score": 0.7305186749791176, "cosine_sim": 0.6867692839036744, "chunk_len": 845, "preview": "This flaw allows an attacker to execute arbitrary code on the system by abusing the python/object/new constructor. This flaw is due to an incomplete fix for CVE", "source_file": "PyYAML.txt", "latency": 8.119400001305621}
{"technique": "semantic", "query": "What PyYAML method could allow arbitrary code execution and when was it fixed?", "rank": 2, "store_score": 0.7238428272634068, "cosine_sim": 0.726753249451751, "chunk_len": 1107, "preview": "package: PyYAML (version:pyyaml/5.3) vulnerability count: 4  id: PYSEC-2020-96 aliases: CVE-2020-1747, CVE-2025-50460, GHSA-6757-jp84-gxfx, GHSA-fm6c-f59h-7mmg ", "source_file": "PyYAML.txt", "latency": 8.119400001305621}
{"technique": "semantic", "query": "What PyYAML method could allow arbitrary code execution and when was it fixed?", "rank": 3, "store_score": 0.7102872645532369, "cosine_sim": 0.6335310828338969, "chunk_len": 653, "preview": "This flaw allows an attacker to execute arbitrary code on the system by abusing the python/object/new constructor. This flaw is due to an incomplete fix for CVE", "source_file": "PyYAML.txt", "latency": 8.119400001305621}
{"technique": "semantic", "query": "What bug affected Paramiko's write_private_key_file?", "rank": 1, "store_score": 0.7331680209282149, "cosine_sim": 0.7150091588376839, "chunk_len": 704, "preview": "package: paramiko (version:paramiko/2.4.1) vulnerability count: 4  id: PYSEC-2022-166 aliases: CVE-2022-24302, GHSA-f8q4-jwww-x3wv summary: None details: In Par", "source_file": "paramiko.txt", "latency": 7.992000002559507}
{"technique": "semantic", "query": "What bug affected Paramiko's write_private_key_file?", "rank": 2, "store_score": 0.5754923212128946, "cosine_sim": 0.5331738596991491, "chunk_len": 578, "preview": "vulnerability fixed in versions: 2.4.2, 2.3.3, 2.2.4, 2.1.6, 2.0.9 links:  --------------------------- id: GHSA-r374-rxx8-8654 aliases: CVE-2026-44405, PYSEC-20", "source_file": "paramiko.txt", "latency": 7.992000002559507}
{"technique": "semantic", "query": "What bug affected Paramiko's write_private_key_file?", "rank": 3, "store_score": 0.4302944037611603, "cosine_sim": 0.4013753060649975, "chunk_len": 2676, "preview": "This can lead to security issues in various situations, such as the most commonly used signature verification (ECDSA) and shared key negotiation (ECDH). When th", "source_file": "cryptography.txt", "latency": 7.992000002559507}
{"technique": "semantic", "query": "What NumPy component had a string comparision bug and when was it fixed?", "rank": 1, "store_score": 0.6438786751020473, "cosine_sim": 0.6877965828168188, "chunk_len": 376, "preview": "package: numpy (version:numpy/1.21.0) vulnerability count: 1  id: GHSA-fpfv-jqm9-f5jm aliases: CVE-2021-34141, PYSEC-2021-855 summary: None details: Incomplete ", "source_file": "numpy.txt", "latency": 6.450199998653261}
{"technique": "semantic", "query": "What NumPy component had a string comparision bug and when was it fixed?", "rank": 2, "store_score": 0.3580281118644099, "cosine_sim": 0.3496219164474602, "chunk_len": 653, "preview": "This flaw allows an attacker to execute arbitrary code on the system by abusing the python/object/new constructor. This flaw is due to an incomplete fix for CVE", "source_file": "PyYAML.txt", "latency": 6.450199998653261}
{"technique": "semantic", "query": "What NumPy component had a string comparision bug and when was it fixed?", "rank": 3, "store_score": 0.35563791834837377, "cosine_sim": 0.3502011060755762, "chunk_len": 6436, "preview": "### Patches Patched version: 12.2.0.  PdfParser (introduced in Pillow 4.2.0) follows Prev pointers in PDF trailers to read cross-reference sections. If a traile", "source_file": "pillow.txt", "latency": 6.450199998653261}
{"technique": "semantic", "query": "Which package has the most vulnerabilites in the datasets?", "rank": 1, "store_score": 0.38582285795735216, "cosine_sim": 0.42865609164071083, "chunk_len": 376, "preview": "package: numpy (version:numpy/1.21.0) vulnerability count: 1  id: GHSA-fpfv-jqm9-f5jm aliases: CVE-2021-34141, PYSEC-2021-855 summary: None details: Incomplete ", "source_file": "numpy.txt", "latency": 8.151500001986278}
{"technique": "semantic", "query": "Which package has the most vulnerabilites in the datasets?", "rank": 2, "store_score": 0.3468913204371132, "cosine_sim": 0.35019274272291423, "chunk_len": 6220, "preview": "package: pillow (version:pillow/8.2.0) vulnerability count: 52  id: PYSEC-2021-331 aliases: CVE-2021-34552, GHSA-7534-mm45-c74v summary: None details: Pillow th", "source_file": "pillow.txt", "latency": 8.151500001986278}
{"technique": "semantic", "query": "Which package has the most vulnerabilites in the datasets?", "rank": 3, "store_score": 0.3371657325697738, "cosine_sim": 0.3653976498432271, "chunk_len": 1866, "preview": "package: Django (version:django/1.11.28) vulnerability count: 18  id: PYSEC-2020-36 aliases: BIT-django-2020-9402, CVE-2020-9402, GHSA-3gh2-xw74-jmcw, PYSEC-202", "source_file": "Django.txt", "latency": 8.151500001986278}
{"technique": "semantic", "query": "Name two packages with RCE related vulnerabilites in SSH or networking code.", "rank": 1, "store_score": 0.3865541352630881, "cosine_sim": 0.3505041270339254, "chunk_len": 3193, "preview": "More details about the vulnerability itself can be found in https://www.openssl.org/news/secadv/20230530.txt.  If you are building cryptography source (\"sdist\")", "source_file": "cryptography.txt", "latency": 7.228899998153793}
{"technique": "semantic", "query": "Name two packages with RCE related vulnerabilites in SSH or networking code.", "rank": 2, "store_score": 0.3796610687331375, "cosine_sim": 0.39146292665432536, "chunk_len": 2856, "preview": "More details about the vulnerabilities themselves can be found in https://www.openssl.org/news/secadv/20221213.txt and https://www.openssl.org/news/secadv/20230", "source_file": "cryptography.txt", "latency": 7.228899998153793}
{"technique": "semantic", "query": "Name two packages with RCE related vulnerabilites in SSH or networking code.", "rank": 3, "store_score": 0.35365541446986826, "cosine_sim": 0.3454630812245813, "chunk_len": 578, "preview": "vulnerability fixed in versions: 2.4.2, 2.3.3, 2.2.4, 2.1.6, 2.0.9 links:  --------------------------- id: GHSA-r374-rxx8-8654 aliases: CVE-2026-44405, PYSEC-20", "source_file": "paramiko.txt", "latency": 7.228899998153793}
{"technique": "sentenceWindow", "query": "What PyYAML method could allow arbitrary code execution and when was it fixed?", "rank": 1, "store_score": 0.7122931826318936, "cosine_sim": 0.7256470891631759, "chunk_len": 413, "preview": "package: PyYAML (version:pyyaml/5.3) vulnerability count: 4  id: PYSEC-2020-96 aliases: CVE-2020-1747, CVE-2025-50460, GHSA-6757-jp84-gxfx, GHSA-fm6c-f59h-7mmg ", "source_file": "PyYAML.txt", "latency": 18.979399999807356}
{"technique": "sentenceWindow", "query": "What PyYAML method could allow arbitrary code execution and when was it fixed?", "rank": 2, "store_score": 0.706814692724445, "cosine_sim": 0.4460866878703384, "chunk_len": 115, "preview": "This flaw allows an attacker to execute arbitrary code on the system by abusing the python/object/new constructor. ", "source_file": "PyYAML.txt", "latency": 18.979399999807356}
{"technique": "sentenceWindow", "query": "What PyYAML method could allow arbitrary code execution and when was it fixed?", "rank": 3, "store_score": 0.706814692724445, "cosine_sim": 0.4460866878703384, "chunk_len": 115, "preview": "This flaw allows an attacker to execute arbitrary code on the system by abusing the python/object/new constructor. ", "source_file": "PyYAML.txt", "latency": 18.979399999807356}
{"technique": "sentenceWindow", "query": "What bug affected Paramiko's write_private_key_file?", "rank": 1, "store_score": 0.7891964875855857, "cosine_sim": 0.7711990802247894, "chunk_len": 315, "preview": "package: paramiko (version:paramiko/2.4.1) vulnerability count: 4  id: PYSEC-2022-166 aliases: CVE-2022-24302, GHSA-f8q4-jwww-x3wv summary: None details: In Par", "source_file": "paramiko.txt", "latency": 19.292400000267662}
{"technique": "sentenceWindow", "query": "What bug affected Paramiko's write_private_key_file?", "rank": 2, "store_score": 0.6412730222768084, "cosine_sim": 0.32539294028084276, "chunk_len": 69, "preview": "vulnerability fixed in versions:  links:  ---------------------------", "source_file": "paramiko.txt", "latency": 19.292400000267662}
{"technique": "sentenceWindow", "query": "What bug affected Paramiko's write_private_key_file?", "rank": 3, "store_score": 0.622198775729132, "cosine_sim": 0.5613412682848823, "chunk_len": 271, "preview": "vulnerability fixed in versions: 2.4.2, 2.3.3, 2.2.4, 2.1.6, 2.0.9 links:  --------------------------- id: GHSA-r374-rxx8-8654 aliases: CVE-2026-44405, PYSEC-20", "source_file": "paramiko.txt", "latency": 19.292400000267662}
{"technique": "sentenceWindow", "query": "What NumPy component had a string comparision bug and when was it fixed?", "rank": 1, "store_score": 0.6264926712393418, "cosine_sim": 0.6595318335982803, "chunk_len": 303, "preview": "package: numpy (version:numpy/1.21.0) vulnerability count: 1  id: GHSA-fpfv-jqm9-f5jm aliases: CVE-2021-34141, PYSEC-2021-855 summary: None details: Incomplete ", "source_file": "numpy.txt", "latency": 22.538099998200778}
{"technique": "sentenceWindow", "query": "What NumPy component had a string comparision bug and when was it fixed?", "rank": 2, "store_score": 0.5816294804897553, "cosine_sim": 0.262929101599153, "chunk_len": 73, "preview": "vulnerability fixed in versions: 1.22 links:  ---------------------------", "source_file": "numpy.txt", "latency": 22.538099998200778}
{"technique": "sentenceWindow", "query": "What NumPy component had a string comparision bug and when was it fixed?", "rank": 3, "store_score": 0.3726211972555616, "cosine_sim": 0.36884570835772607, "chunk_len": 193, "preview": "The bug is reachable through the public save API:  ```python im.save(out, format=\"TGA\", compression=\"tga_rle\") ```  Older affected Pillow versions use the equiv", "source_file": "pillow.txt", "latency": 22.538099998200778}
{"technique": "sentenceWindow", "query": "Which package has the most vulnerabilites in the datasets?", "rank": 1, "store_score": 0.4269372366092575, "cosine_sim": 0.4847990656467272, "chunk_len": 303, "preview": "package: numpy (version:numpy/1.21.0) vulnerability count: 1  id: GHSA-fpfv-jqm9-f5jm aliases: CVE-2021-34141, PYSEC-2021-855 summary: None details: Incomplete ", "source_file": "numpy.txt", "latency": 20.218499998009065}
{"technique": "sentenceWindow", "query": "Which package has the most vulnerabilites in the datasets?", "rank": 2, "store_score": 0.40205594415371876, "cosine_sim": 0.4495544475793688, "chunk_len": 372, "preview": "package: Django (version:django/1.11.28) vulnerability count: 18  id: PYSEC-2020-36 aliases: BIT-django-2020-9402, CVE-2020-9402, GHSA-3gh2-xw74-jmcw, PYSEC-202", "source_file": "Django.txt", "latency": 20.218499998009065}
{"technique": "sentenceWindow", "query": "Which package has the most vulnerabilites in the datasets?", "rank": 3, "store_score": 0.3520773122440646, "cosine_sim": 0.34902080227094245, "chunk_len": 268, "preview": "vulnerability fixed in versions: 42.0.2 links:  --------------------------- id: PYSEC-2026-2141 aliases: CVE-2026-26007, GHSA-r6ph-v2qm-q3c2 summary: None detai", "source_file": "cryptography.txt", "latency": 20.218499998009065}
{"technique": "sentenceWindow", "query": "Name two packages with RCE related vulnerabilites in SSH or networking code.", "rank": 1, "store_score": 0.4608526063461578, "cosine_sim": 0.4515095687466853, "chunk_len": 326, "preview": "vulnerability fixed in versions: 2.9.3, 2.10.1 links:  --------------------------- id: GHSA-f2j6-wrhh-v25m aliases: CVE-2018-1000805, PYSEC-2018-69 summary: Non", "source_file": "paramiko.txt", "latency": 24.156700001185527}
{"technique": "sentenceWindow", "query": "Name two packages with RCE related vulnerabilites in SSH or networking code.", "rank": 2, "store_score": 0.3856179826378853, "cosine_sim": 0.42900134835625914, "chunk_len": 117, "preview": "More details about the vulnerabilities themselves can be found in https://www.openssl.org/news/secadv/20230908.txt.  ", "source_file": "cryptography.txt", "latency": 24.156700001185527}
{"technique": "sentenceWindow", "query": "Name two packages with RCE related vulnerabilites in SSH or networking code.", "rank": 3, "store_score": 0.38329037381191355, "cosine_sim": 0.3991560332907133, "chunk_len": 170, "preview": "More details about the vulnerabilities themselves can be found in https://www.openssl.org/news/secadv/20221213.txt and https://www.openssl.org/news/secadv/20230", "source_file": "cryptography.txt", "latency": 24.156700001185527}

README.md

## Homework 3 Report Answers

For the query “Which package has the most vulnerabilities in the dataset?”, I noticed that the first rank labeled the package numpy as the answer. This is incorrect and the cosine similarity is 0.429 approximately. It shows that there is one vulnerability for NumPy, while the Pillow package has 52 vulnerabilities. The Pillow package answer is ranked below the NumPy one which shows that the most confident score retrieval does not contain the correct answer. Its most likely considered similar because the keywords in the query hit the package.txt file. The embedding only accounts for the wording similarity, so the vulnerability count value is not used for the comparison. Therefore, NumPy was ranked first.

The results of the pipeline show that the sentence window retrieval did the best when answering the query "What bug affected Paramiko's write_private_key_file?". Because the query is simple, I believe the cosine similarity for sentence window technique was ranked first with a value of 0.7712. Token and semantic respectively had 0.7290 and 0.7150. It appears the sentence window result showed 315 characters, which is considerably less compared to the other techniques. I believe with less characters it was able to find the answer faster with less of a chance of it getting unnecessary information.

The best technique is the sentence window technique. By looking at all the results, I see that the top two cosine similarities are 0.7712 and 0.7256 for the sentence window technique. These cosine similarities are for the queries asking about Paramiko and PyYAML packages specifically. The query about NumPy and which packages have the most vulnerabilities show that the token technique is the best. These cosine similarities are the third and fourth highest. The values are 0.6878 and 0.4287. There is a noticeable gap between the top 2 and the third and fourth highest. Lastly, the last question about the RCE has a fifth highest cosine similarity value of 0.4515. The best technique for this question is the sentence window method.

For this whole experiment, I think the sentence window technique is the best because it showed the strongest cosine similarity out of all three techniques. Out of the five questions, sentence window technique had the highest cosine similarity of all three techniques for 3 out of 5 questions. Additionally, the top two cosine similarity values are from the sentence window technique. The values are 0.7712 and 0.7256 for the query questions about Paramiko and PyYAML packages specifically. I believed this technique is also the best because of the smaller